{
  "$schema": "https://json-schema.org/draft/2020-12/schema",
  "title": "artifact-verification",
  "description": "Machine-written proof that the verification step ran for a stage. Presence gate input: proves the step ran, not who ran it — actor is attribution, never authorization. Written to plans/<active-plan>/artifacts/verification.json.",
  "type": "object",
  "required": [
    "stage",
    "plan",
    "actor",
    "ts",
    "checks",
    "verdict"
  ],
  "properties": {
    "stage": {
      "type": "string",
      "description": "Stage this verification covers (push|pr|merge|ship|deploy); descriptive only, not enum-validated"
    },
    "plan": {
      "type": "string",
      "description": "Plan dir name this verification belongs to"
    },
    "phase": {
      "type": "string",
      "description": "Optional: the plan-graph node id (e.g. P3) this verification covers. Additive/optional (back-compat: an old verification omitting it still passes the gate). Enables the per-phase evidence snapshot (verification-<phase>.json) that derive_plan_completion counts for safe auto-close; a verification missing phase is simply not snapshotted (under-count, never over-close)."
    },
    "actor": {
      "type": "string",
      "description": "resolve_actor() output: user:<u>[/agent:<a>] | ci"
    },
    "ts": {
      "type": "string",
      "description": "ISO-8601 timestamp"
    },
    "checks": {
      "type": "array",
      "minItems": 1,
      "items": {
        "type": "object",
        "required": [
          "name",
          "status"
        ],
        "properties": {
          "name": {
            "type": "string",
            "description": "check name; for a DoD test type this is the test_type id (unit|integration|regression|coverage|security|...)"
          },
          "status": {
            "enum": [
              "PASS",
              "FAIL",
              "SKIP",
              "BLOCKED"
            ],
            "description": "PASS/SKIP clear the gate. FAIL = measured and wrong. BLOCKED = could not be measured at all (missing tool, no network, not yet owned) — it blocks exactly like FAIL, and exists so a report can count holes apart from defects."
          },
          "detail": {
            "type": "string"
          },
          "format": {
            "enum": [
              "junit",
              "cobertura",
              "jacoco",
              "sarif",
              "manual"
            ],
            "description": "result format the DoD gate re-reads this check's raw file with; optional (only on test-type checks). A check carrying `format` is DoD-bearing: its `name` MUST equal a canonical test_type id (harness/data/test-policy.yaml) or the DoD gate reads it as a MISSING type. `manual` carries telemetry-anchored evidence instead of a result file (see evidence_tier/anchor_id/charter_cosign)"
          },
          "file": {
            "type": "string",
            "description": "result file path relative to the plan's artifacts/ dir; the DoD gate re-derives pass/fail from THIS raw file, not from status. Must resolve under artifacts/ (no symlink escape)"
          },
          "evidence_tier": {
            "enum": [
              "anchored",
              "claimed"
            ],
            "description": "manual check only: `anchored` cites a Bash trace the manual-test hook witnessed (a floor, not authentication); `claimed` is agent-written and below the floor"
          },
          "anchor_id": {
            "type": "string",
            "description": "manual check only: the cited anchor id (sha256/16) the DoD gate cross-checks against the manual-test anchor telemetry; a fabricated id is rejected. `trace_id` is accepted as an alias"
          },
          "trace_id": {
            "type": "string",
            "description": "manual check only: alias for anchor_id"
          },
          "cmd": {
            "type": "string",
            "description": "manual check only: the exact command that was run — carried so a reviewer on another machine can re-run it and so manual_test.verify_portable (transport-integrity, not a gate input) can recompute cmd_hash"
          },
          "cmd_hash": {
            "type": "string",
            "description": "manual check only: sha256(cmd)[:16]; for a human to recompute portability, NOT a tier signal"
          },
          "output_hash": {
            "type": "string",
            "description": "manual check only: sha256(real captured output)[:16]; a reviewer re-runs the real command and compares — transport-integrity only, grants no tier"
          },
          "charter_cosign": {
            "type": "string",
            "description": "manual check only: a reviewer distinct from actor (personal-first: a distinct attribution string, not a roster check) who co-signed the charter; required for a HARD manual requirement — anchored output without a co-sign, or a self co-sign equal to actor, stays soft"
          }
        }
      },
      "description": "Named checks; any FAIL blocks hard stages. A check carrying format+file feeds the DoD-by-change-class gate, which re-reads the raw file (self-report does not self-approve)"
    },
    "verdict": {
      "enum": [
        "PASS",
        "PASS_WITH_RISK",
        "BLOCKED"
      ],
      "description": "Overall verdict of the verification run"
    },
    "change_class": {
      "type": "string",
      "description": "Optional: the derived change-class (feature|bugfix|refactor|dep_bump_major|release) this run targeted; informational/telemetry — the gate re-derives from the git diff, it does not trust this field"
    },
    "signals": {
      "type": "array",
      "items": {
        "type": "string"
      },
      "description": "Optional: the fact-signals behind the derived change_class (src_changed, test_has_assertions, ...). Telemetry only; not a gate input"
    },
    "grace": {
      "type": "object",
      "description": "Optional: a recorded policy grace honored for this run (carries reason + expires); written for audit visibility, never to lower the gate by itself",
      "properties": {
        "reason": {
          "type": "string"
        },
        "expires": {
          "type": "string",
          "description": "ISO date; past it the gate stops honoring the grace and re-blocks hard"
        }
      }
    },
    "ticket_id": {
      "type": "string",
      "description": "Optional free-form issue/MR reference"
    }
  }
}
